{
  "name": "date-specific-after",
  "description": "after:YYYY-MM-DD parses as DateRange{ After, Specific }.",
  "spec": {
    "source": "Gmail search operators",
    "url": "https://support.google.com/mail/answer/7190",
    "behavior": "after: matches messages received strictly after the given date."
  },
  "input": "after:2026-01-01",
  "expected_ast": {
    "DateRange": {
      "bound": "after",
      "date": { "Specific": "2026-01-01" }
    }
  }
}
