{
  "name": "boolean-precedence-implicit-and-binds-tighter-than-or",
  "description": "OR has lower precedence than implicit AND. `a b OR c` parses as `(a AND b) OR c`.",
  "spec": {
    "source": "Gmail search operators",
    "url": "https://support.google.com/mail/answer/7190",
    "behavior": "Tight binding for adjacency lets users write natural-language conjunctions without parens."
  },
  "input": "invoice unread OR receipt",
  "expected_ast": {
    "Or": [
      {
        "And": [
          { "Text": "invoice" },
          { "Text": "unread" }
        ]
      },
      { "Text": "receipt" }
    ]
  }
}
