{
  "name": "text-bare-word",
  "description": "A bare word parses as Text. Subject to the backend's tokenizer/stemmer.",
  "spec": {
    "source": "Gmail search operators",
    "url": "https://support.google.com/mail/answer/7190",
    "behavior": "Free-text terms without an operator prefix are general search terms."
  },
  "input": "deployment",
  "expected_ast": { "Text": "deployment" }
}
